2026-02-20 04:00:00,"Kragujevac, Serbia",14789,23.0,8.0,1.2
2026-02-20 04:00:00,"Pančevo Starčevo, Serbia",8762,36.0,11.0,5.3
2026-02-20 04:00:00,"Str. Carpati, Deva, Romania",7651,0.0,24.0,7.2
2026-02-20 04:00:00,"Lublin ul.Obywatelska, Poland",6480,168.0,72.0,23.2
2026-02-20 04:00:00,"Devnya - Izvorite, Bulgaria",10567,0.0,21.0,9.0
2026-02-20 04:00:00,"Bdul Bucuresti, Ploieşti, Romania",4186,0.0,36.0,11.0
2026-02-20 04:00:00,"Str. Libertatii, Turnu Magurele, Romania",4161,0.0,11.0,12.5
2026-02-20 04:00:00,"Bdul. Dacia, Oradea, Romania",6837,0.0,42.0,3.8
2026-02-20 04:00:00,"Nowy Sącz, Małopolska, Poland",3404,75.0,28.0,6.5
2026-02-20 04:00:00,"Ursynów, Warszawa, Mazowieckie, Poland",3392,129.0,45.0,30.3
2026-02-20 04:00:00,"Bdul. N. Iorga, Iasi, Romania",6861,0.0,43.0,24.1
2026-02-20 04:00:00,"Nam. slobody, Humenne, Slovakia",3126,97.0,27.0,3.2
2026-02-20 04:00:00,"Małogoszcz, ul. Słoneczna 18, Poland",14912,105.0,39.0,7.4
2026-02-20 04:00:00,"Vratsa - ZHP Gara, Bulgaria",10561,0.0,8.0,2.9
2026-02-20 04:00:00,"Str. Constructorilor, Rovinari, Romania",4176,98.0,39.0,3.6
2026-02-20 04:00:00,"Comuna Sânpetru, Sânpetru, Romania",4191,0.0,26.0,5.4
2026-02-20 04:00:00,"Str. Rozelor, Oţelu Roşu, Romania",6848,0.0,18.0,4.5
2026-02-20 04:00:00,"Str. Vasile Alecsandri, Târgu Jiu, Romania",8581,71.0,25.0,8.5
2026-02-20 04:00:00,"Jarosław-PWSTE-WIOS, Poland",13040,69.0,22.0,0.0
2026-02-20 04:00:00,"str. Principala, Buchin, Romania",4171,0.0,14.0,12.4
2026-02-20 04:00:00,"EMEP, AU SAV, Stara Lesna, Slovakia",3127,78.0,24.0,2.8
2026-02-20 04:00:00,"Rzeszów-Piłsudskiego-WIOS, Poland",13042,105.0,41.0,26.1
2026-02-20 04:00:00,"Nowiny ul. Parkowa, Poland",6550,0.0,58.0,19.7
2026-02-20 04:00:00,"Str. Lacul Morii, Lacul Morii, Romania",7655,78.0,30.0,33.1
2026-02-20 04:00:00,"Com. Budeasa, Caloteşti, Romania",6833,0.0,14.0,2.5
2026-02-20 04:00:00,"Bdul Bucuresti, Baia Mare, Romania",4181,0.0,9.0,18.1
2026-02-20 04:00:00,"Piata Unirii, Timişoara, Romania",7660,0.0,25.0,9.4
2026-02-20 04:00:00,"Str.Alexandru cel Bun, Siret, Romania",6875,0.0,22.0,9.6
2026-02-20 04:00:00,"Str. Nufărului, Oradea, Romania",6838,0.0,19.0,10.1
2026-02-20 04:00:00,"Shumen, Bulgaria",10563,0.0,12.0,6.2
2026-02-20 04:00:00,"Str. Dunarii, Alexandria, Romania",4160,0.0,11.0,9.9
2026-02-20 04:00:00,"Str. Industriei, Urziceni, Romania",6860,0.0,17.0,10.5
2026-02-20 04:00:00,"Biała Podlaska, Poland",6479,0.0,69.0,11.9
2026-02-20 04:00:00,"Zamość, Poland",6481,169.0,73.0,14.3
2026-02-20 04:00:00,"Sajószentpéter, Sajószentpéter, Hungary",3357,70.0,20.0,3.2
2026-02-20 04:00:00,"SNP, Krompachy, Slovakia",3144,87.0,29.0,5.1
2026-02-20 04:00:00,"Beograd Sopot, Serbia",14785,29.0,8.0,0.1
2026-02-20 04:00:00,"Beograd Ada Marina, Serbia",14779,31.0,9.0,1.4
2026-02-20 04:00:00,"Str. Baile Jigodin, Miercurea Ciuc, Romania",7652,0.0,25.0,10.3
2026-02-20 04:00:00,"Str. Ostrovei, Râmnicu Vâlcea, Romania",6876,0.0,23.0,6.2
2026-02-20 04:00:00,"Brzozowa, Otwock, Mazowieckie, Poland",9037,56.0,15.0,7.2
2026-02-20 04:00:00,"Pirot, Serbia",14562,18.0,5.0,1.2
2026-02-20 04:00:00,"Str. Lalelelor, Alba Iulia, Romania",4162,0.0,32.0,6.7
2026-02-20 04:00:00,"Sos. 1 Decembrie 1918, Giurgiu, Romania",4177,0.0,26.0,13.9
2026-02-20 04:00:00,"Nyíregyháza, Nyíregyháza, Hungary",3380,46.0,14.0,2.3
2026-02-20 04:00:00,"DC-86, Năvodari, Romania",4172,0.0,14.0,7.3
2026-02-20 04:00:00,"Veliki Crljeni, Serbia",14563,23.0,6.0,12.8
2026-02-20 04:00:00,"Oszlár, Oszlár, Hungary",3355,0.0,10.0,0.0
2026-02-20 04:00:00,"Str. Izvoare, Bacău, Romania",4165,0.0,22.0,19.3
2026-02-20 04:00:00,"Debrecen Kalotaszeg tér, Debrecen, Hungary",3378,53.0,16.0,6.8
2026-02-20 04:00:00,"Szolnok, Szolnok, Hungary",3358,0.0,7.0,0.0
2026-02-20 04:00:00,"Tochtermana, Radom, Mazowieckie, Poland",3393,156.0,62.0,18.8
2026-02-20 04:00:00,"G.Oryahovitsa, Bulgaria",10572,0.0,11.0,8.2
2026-02-20 04:00:00,"Str. Piata Victoriei, Ploieşti, Romania",6868,0.0,26.0,10.2
2026-02-20 04:00:00,"Str. Unirii, Moldova Noua, Romania",4192,0.0,15.0,0.0
2026-02-20 04:00:00,"Str. Traian, Galaţi, Romania",7650,0.0,14.0,15.3
2026-02-20 04:00:00,"Beograd Obrenovac Ušće, Serbia",14564,7.0,2.0,1.0
2026-02-20 04:00:00,"Comuna Ungheni, Ungheni, Romania",8587,0.0,36.0,5.4
2026-02-20 04:00:00,"Krosno-Kletówki-WIOS, Poland",14678,56.0,16.0,0.0
2026-02-20 04:00:00,"odesa; Odessa Gonzales, Midland, Texas",196,5.0,0.0,0.0
2026-02-20 04:00:00,"elpueleutodesantamalia; Rio San Pedro, Puerto Real, Spain",8448,21.0,7.0,0.5
2026-02-20 04:00:00,"rhode-saint-genese; Ukkel, Belgium",2992,59.0,19.0,9.2
2026-02-20 04:00:00,"telaviva; Tel Aviv (ישראל, Aviv)",5783,51.0,27.0,3.5
2026-02-20 04:00:00,"telaviva; Komemiyut Train Station - Gush Dan, Israel (ישראל,רכבת קוממיות, גוש דן)",9991,88.0,0.0,19.7
2026-02-20 04:00:00,"telaviva; The Haganah Train - Gush Dan, Israel (ישראל,רכבת ההגנה, גוש דן)",9989,81.0,0.0,17.5
2026-02-20 04:00:00,"telaviva; Yoseftal Train - Gush Dan, Israel (ישראל,רכבת יוספטל, גוש דן)",9990,79.0,0.0,14.1
2026-02-20 04:00:00,"telaviva; The Peace Train - Gush Dan, Israel (ישראל,רכבת השלום, גוש דן)",9992,77.0,0.0,21.6
2026-02-20 04:00:00,"telaviva; Or Yehuda - inner plain, Israel (ישראל,אור יהודה, שפלה פנימית)",9987,63.0,0.0,11.4
2026-02-20 04:00:00,"telaviva; Levinsky, Tel Aviv Metropolitan Area, Israel (ישראל,לוינסקי, גוש דן)",11911,59.0,44.0,13.3
2026-02-20 04:00:00,"telaviva; Hint, Gush Dan, Israel (ישראל,רמז, גוש דן)",2964,53.0,27.0,7.5
2026-02-20 04:00:00,"telaviva; Antokolski Gush Dan, Israel (ישראל,אנטוקולסקי, גוש דן)",2962,51.0,0.0,3.5
2026-02-20 04:00:00,"telaviva; Highway 4, Gush Dan, Israel (ישראל,כביש 4, גוש דן)",2959,50.0,27.0,21.6
2026-02-20 04:00:00,"telaviva; Urban D, Gush Dan, Israel (ישראל,עירוני ד, גוש דן)",2960,48.0,27.0,11.6
2026-02-20 04:00:00,"telaviva; Through the D'', Gush Dan, Israel (ישראל,דרך פ''ת, גוש דן)",2963,48.0,0.0,5.0
2026-02-20 04:00:00,"telaviva; Holon, Gush Dan, Israel (ישראל,חולון, גוש דן)",2958,47.0,27.0,9.5
2026-02-20 05:00:00,"Comuna Baloteşti, Baloteşti, Romania",7658,88.0,31.0,9.1
2026-02-20 05:00:00,"Str. Industriei, Urziceni, Romania",6860,0.0,17.0,10.4
2026-02-20 05:00:00,"Str. Baile Jigodin, Miercurea Ciuc, Romania",7652,0.0,27.0,10.3
2026-02-20 05:00:00,"Comuna Sânpetru, Sânpetru, Romania",4191,0.0,26.0,5.1
2026-02-20 05:00:00,"Str. Libertăţii, Târgu Mureş, Romania",6865,0.0,29.0,21.2
2026-02-20 05:00:00,"Połaniec, Poland",6551,107.0,46.0,18.7
2026-02-20 05:00:00,"Varna - SOU Angel Kanchev, Bulgaria",10577,22.0,13.0,6.6
2026-02-20 05:00:00,"Str. Libertatii, Turnu Magurele, Romania",4161,0.0,11.0,11.8
2026-02-20 05:00:00,"Str. Brestei, Breasta, Romania",6853,0.0,19.0,6.4
2026-02-20 05:00:00,"Bd Mihai Eminescu, Botoşani, Romania",4168,0.0,25.0,10.9
2026-02-20 05:00:00,"Lublin ul.Obywatelska, Poland",6480,180.0,84.0,22.4
2026-02-20 05:00:00,"Str. Petru Maior, Reşiţa, Romania",4170,0.0,16.0,3.5
2026-02-20 05:00:00,"str. Principala, Buchin, Romania",4171,0.0,14.0,14.9
2026-02-20 05:00:00,"Str. Mărăşeşti, Suceava, Romania",4194,107.0,39.0,5.7
2026-02-20 05:00:00,"Str. Rozelor, Oţelu Roşu, Romania",6848,0.0,18.0,6.9
2026-02-20 05:00:00,"Zeleznicna, Poprad, Slovakia",13827,89.0,30.0,2.8
2026-02-20 05:00:00,"Nowy Sącz, Małopolska, Poland",3404,68.0,26.0,7.3
2026-02-20 05:00:00,"Kraków, os. Wadów, Małopolska, Poland",10041,106.0,39.0,13.6
2026-02-20 05:00:00,"Vratsa - ZHP Gara, Bulgaria",10561,0.0,8.0,2.9
2026-02-20 05:00:00,"Str. Carpati, Deva, Romania",7651,0.0,24.0,7.3
2026-02-20 05:00:00,"Bdul Unirii, Baia Mare, Romania",4182,0.0,10.0,9.7
2026-02-20 05:00:00,"Jarosław-PWSTE-WIOS, Poland",13040,78.0,27.0,0.0
2026-02-20 05:00:00,"Kazincbarcika, Kazincbarcika, Hungary",3351,65.0,19.0,6.3
2026-02-20 05:00:00,"Sos. Sloboziei, Giurgiu, Romania",8585,0.0,19.0,11.6
2026-02-20 05:00:00,"str. Muncii, Turceni, Romania",7649,0.0,18.0,6.2
2026-02-20 05:00:00,"Smederevo Radinac, Serbia",14566,45.0,12.0,1.7
2026-02-20 05:00:00,"Debrecen Kalotaszeg tér, Debrecen, Hungary",3378,53.0,17.0,8.0
2026-02-20 05:00:00,"Str. Decebal, Medgidia, Romania",4175,0.0,5.0,12.7
2026-02-20 05:00:00,"Str.Alexandru cel Bun, Siret, Romania",6875,0.0,23.0,8.2
2026-02-20 05:00:00,"Miskolc Lavotta, Miskolc, Hungary",3353,0.0,34.0,0.0
2026-02-20 05:00:00,"Krosno-Kletówki-WIOS, Poland",14678,71.0,26.0,0.0
2026-02-20 05:00:00,"Str. Ostrovei, Râmnicu Vâlcea, Romania",6876,0.0,23.0,6.1
2026-02-20 05:00:00,"str. Mihai Viteazu, Vulcan, Romania",4193,0.0,23.0,12.2
2026-02-20 05:00:00,"Str. Drumul Taberei, Drumul Taberei, Romania",7656,0.0,25.0,35.4
2026-02-20 05:00:00,"Str. Constructorilor, Rovinari, Romania",4176,100.0,39.0,16.0
2026-02-20 05:00:00,"Str. Băile Romane, Drobeta Turnu Severin, Romania",6862,0.0,22.0,16.7
2026-02-20 05:00:00,"Aleea Biciclistilor, Hunedoara, Romania",6859,0.0,49.0,19.2
2026-02-20 05:00:00,"Pod Vinbargom, Bardejov, Slovakia",13822,72.0,27.0,3.7
2026-02-20 05:00:00,"Str. Aurel Vlaicu, Cluj-Napoca, Romania",8591,0.0,24.0,23.3
2026-02-20 05:00:00,"Beograd Mladenovac, Serbia",14784,35.0,10.0,1.4
2026-02-20 05:00:00,"Beograd Ada Marina, Serbia",14779,33.0,8.0,3.3
2026-02-20 05:00:00,"Beograd Borča, Serbia",14781,46.0,12.0,19.8
2026-02-20 05:00:00,"Beograd Zemun Ugrinovačka, Serbia",14788,42.0,11.0,6.9
2026-02-20 05:00:00,"Str. Gării, Mediaş, Romania",4187,0.0,22.0,12.3
2026-02-20 05:00:00,"Str. Tudor Vladimirescu, Zlatna, Romania",6831,0.0,35.0,13.9
2026-02-20 05:00:00,"Str. Parcului, Bistriţa, Romania",8578,0.0,18.0,3.7
2026-02-20 05:00:00,"Dumbierska, Kosice, Slovakia",3112,99.0,34.0,0.0
2026-02-20 05:00:00,"Tochtermana, Radom, Mazowieckie, Poland",3393,154.0,60.0,20.8
2026-02-20 05:00:00,"Starachowice, ul. Złota, Poland",14913,151.0,70.0,0.0
2026-02-20 05:00:00,"DC-86, Năvodari, Romania",4172,0.0,13.0,7.9
2026-02-20 05:00:00,"Čačak, Serbia",14558,30.0,11.0,6.4
2026-02-20 05:00:00,"Beograd Obrenovac Ušće, Serbia",14564,8.0,2.0,2.9
2026-02-20 05:00:00,"Calea Macin, Isaccea, Romania",4188,0.0,16.0,17.6
2026-02-20 05:00:00,"EMEP, Vodna nadrz, Starina, Slovakia",3130,59.0,13.0,2.3
2026-02-20 05:00:00,"Str. Victoriei, Piteşti, Romania",7644,82.0,28.0,15.0
2026-02-20 05:00:00,"Biała Podlaska, Poland",6479,0.0,77.0,21.4
2026-02-20 05:00:00,"Oszlár, Oszlár, Hungary",3355,0.0,24.0,0.0
2026-02-20 05:00:00,"Meteo. st, Ganovce, Slovakia",3128,104.0,34.0,2.3
2026-02-20 05:00:00,"Nowa Huta, Kraków, Małopolska, Poland",3403,106.0,42.0,13.6
2026-02-20 05:00:00,"Nowiny ul. Parkowa, Poland",6550,0.0,56.0,21.7
2026-02-20 05:00:00,"Dobrich - OU Han Asparuh, Bulgaria",10565,0.0,8.0,0.0
2026-02-20 05:00:00,"Bdul Bucuresti, Baia Mare, Romania",4181,0.0,8.0,23.1
2026-02-20 05:00:00,"Zamość, Poland",6481,164.0,67.0,16.1
2026-02-20 05:00:00,"Comuna Valiug, Semenic, Romania",6855,0.0,13.0,3.1
2026-02-20 05:00:00,"Str. Mihai Viteazu, Slobozia, Romania",4179,0.0,5.0,10.9
2026-02-20 05:00:00,"Smederevo Centar, Serbia",9259,52.0,16.0,14.5
2026-02-20 05:00:00,"Pančevo Vatrog dom, Serbia",8817,35.0,9.0,11.5
2026-02-20 05:00:00,"Str. M. Kogălniceanu, Sebeş, Romania",6830,0.0,43.0,14.2
2026-02-20 05:00:00,"Sajószentpéter, Sajószentpéter, Hungary",3357,63.0,18.0,3.7
2026-02-20 05:00:00,"Małogoszcz, ul. Słoneczna 18, Poland",14912,104.0,42.0,10.7
2026-02-20 05:00:00,"Kielce, ul. Targowa 3, Poland",14911,104.0,47.0,28.2
2026-02-20 05:00:00,"Sos. 1 Decembrie 1918, Giurgiu, Romania",4177,0.0,27.0,17.0
2026-02-20 05:00:00,"Kragujevac, Serbia",14789,24.0,10.0,2.2
2026-02-20 05:00:00,"Beograd Surčin, Serbia",14787,31.0,9.0,3.6
2026-02-20 05:00:00,"Str. Piata Victoriei, Ploieşti, Romania",6868,0.0,27.0,14.6
2026-02-20 05:00:00,"Com. Oarja, Oarja, Romania",6834,0.0,12.0,13.7
2026-02-20 05:00:00,"Bdul. Dacia, Oradea, Romania",6837,0.0,41.0,3.5
2026-02-20 05:00:00,"Nam. slobody, Humenne, Slovakia",3126,93.0,25.0,4.6
2026-02-20 05:00:00,"EMEP, AU SAV, Stara Lesna, Slovakia",3127,78.0,24.0,2.8
2026-02-20 05:00:00,"Novi Pazar, Serbia",12894,102.0,36.0,9.8
2026-02-20 05:00:00,"Str. Lalelelor, Alba Iulia, Romania",4162,0.0,33.0,8.7
2026-02-20 05:00:00,"Str. Ioan Slavici, Satu Mare, Romania",6873,0.0,12.0,7.3
2026-02-20 05:00:00,"Szymbark, Szymbark 430, Krakow, Poland",14890,0.0,19.0,0.9
2026-02-20 05:00:00,"Zegrzyńska, Legionowo, Mazowieckie, Poland",4748,104.0,35.0,14.6
2026-02-20 05:00:00,"Beograd Sopot, Serbia",14785,28.0,7.0,0.1
2026-02-20 05:00:00,"Beograd Franša Deperea, Serbia",14782,50.0,17.0,14.3
2026-02-20 05:00:00,"Szeged 2 Rózsa u., Szeged, Hungary",3337,50.0,11.0,3.9
2026-02-20 05:00:00,"Letna, Velka Ida, Slovakia",3122,104.0,43.0,0.0
2026-02-20 05:00:00,"Str. Lunca Oltului, Sfântu Gheorghe, Romania",8579,0.0,7.0,20.4
2026-02-20 05:00:00,"Comuna Ungheni, Ungheni, Romania",8587,0.0,36.0,10.7
2026-02-20 05:00:00,"Str. Rampei, Tarnaveni, Romania",6867,0.0,28.0,5.3
2026-02-20 05:00:00,"T. G. Masaryka, Trebisov, Slovakia",13830,91.0,32.0,3.2
2026-02-20 05:00:00,"Jesenskeho, Jelsava, Slovakia",3116,55.0,17.0,1.9
2026-02-20 05:00:00,"Beograd Leštane, Serbia",14783,53.0,16.0,10.3
2026-02-20 05:00:00,"Str. Teilor, Fieni, Romania",6852,0.0,15.0,8.3
2026-02-20 05:00:00,"Zona Pasaj Micalaca, Arad, Romania",6835,0.0,10.0,12.8
2026-02-20 05:00:00,"Str. Nufărului, Oradea, Romania",6838,0.0,19.0,10.0
2026-02-20 05:00:00,"Hortobágy, Kunmadaras, Hungary",14674,0.0,7.0,0.0
2026-02-20 05:00:00,"M.R.Stefanika, Vranov nad Top., Slovakia",3131,93.0,31.0,6.9
2026-02-20 05:00:00,"Miskolc Alföldi, Miskolc, Hungary",8649,80.0,26.0,0.0
2026-02-20 05:00:00,"Beograd Lazarevac, Serbia",14560,26.0,8.0,1.5
2026-02-20 05:00:00,"Bdul. Gării, Braşov, Romania",7647,0.0,32.0,18.0
2026-02-20 05:00:00,"Str. Izvoare, Bacău, Romania",4165,0.0,21.0,23.8
2026-02-20 05:00:00,"Str. Valea Albă, Piatra Neamţ, Romania",4183,142.0,53.0,6.8
2026-02-20 05:00:00,"Str. Hipodromului, Sibiu, Romania",6870,0.0,14.0,11.6
2026-02-20 05:00:00,"Str. Vasile Alecsandri, Târgu Jiu, Romania",8581,70.0,25.0,14.3
2026-02-20 05:00:00,"Rymanów-Zdrój, Poland",9577,47.0,12.0,0.0
2026-02-20 05:00:00,"Str. Dunarii, Alexandria, Romania",4160,0.0,12.0,8.1
2026-02-20 05:00:00,"Str. Vlad Ţepeş, Târgovişte, Romania",6851,0.0,20.0,20.0
2026-02-20 05:00:00,"Comuna Tetchea, Tetchea, Romania",6839,0.0,30.0,4.6
2026-02-20 05:00:00,"Şoseaua Constanţei, Mangalia, Romania",4173,0.0,10.0,4.4
2026-02-20 05:00:00,"Bdul Dunărea, Galaţi, Romania",8584,0.0,12.0,9.0
2026-02-20 05:00:00,"Calea Pietroasa, Campulung, Romania",4163,0.0,48.0,6.0
2026-02-20 05:00:00,"Aleea Castanilor, Copşa Mică, Romania",6871,0.0,38.0,25.0
2026-02-20 05:00:00,"Hernádszurdok, Hernádszurdok, Hungary",3350,65.0,19.0,0.0
2026-02-20 05:00:00,"Targówek, Warszawa, Mazowieckie, Poland",3391,80.0,29.0,24.3
2026-02-20 05:00:00,"Bdul Bucuresti, Ploieşti, Romania",4186,0.0,35.0,18.7
2026-02-20 05:00:00,"Calea Bucuresti, Craiova, Romania",8580,0.0,22.0,10.7
2026-02-20 05:00:00,"Obrenovac Centar, Serbia",9254,26.0,9.0,4.9
2026-02-20 05:00:00,"Borsukowizna-Wiejska, Poland",11817,52.0,12.0,0.2
2026-02-20 05:00:00,"Szolnok, Szolnok, Hungary",3358,0.0,7.0,0.0
2026-02-20 05:00:00,"Str. Lacul Morii, Lacul Morii, Romania",7655,81.0,31.0,36.5
2026-02-20 05:00:00,"Com. Budeasa, Caloteşti, Romania",6833,0.0,14.0,3.0
2026-02-20 05:00:00,"Str. Unirii, Moldova Noua, Romania",4192,0.0,14.0,0.0
2026-02-20 05:00:00,"Beograd Barajevo, Serbia",14780,24.0,7.0,0.6
2026-02-20 05:00:00,"Tarnów-ul. Ks. Romana Sitko, Małopolska, Poland",8690,112.0,46.0,13.0
2026-02-20 05:00:00,"Str. Războieni, Bacău, Romania",7645,0.0,47.0,20.1
2026-02-20 05:00:00,"Eger 2 Malomárok u., Eger, Hungary",3349,0.0,12.0,6.9
2026-02-20 05:00:00,"Brzozowa, Otwock, Mazowieckie, Poland",9037,56.0,15.0,7.2
2026-02-20 05:00:00,"str. Dorobanti, Nadlac, Romania",6836,0.0,10.0,3.8
2026-02-20 05:00:00,"Arm.gen. L. Svobodu, Presov, Slovakia",3129,97.0,31.0,13.3
2026-02-20 05:00:00,"Devnya - Izvorite, Bulgaria",10567,0.0,21.0,9.0
2026-02-20 05:00:00,"Pančevo Starčevo, Serbia",8762,35.0,10.0,5.7
2026-02-20 05:00:00,"Bdul. N. Iorga, Iasi, Romania",6861,0.0,42.0,29.7
2026-02-20 05:00:00,"Dębica-Grottgera-WIOS, Poland",13039,105.0,42.0,0.0
2026-02-20 05:00:00,"Ursynów, Warszawa, Mazowieckie, Poland",3392,123.0,43.0,29.4
2026-02-20 05:00:00,"Comuna Sinandrei, Sinandrei, Romania",4189,0.0,18.0,6.8
2026-02-20 05:00:00,"G.Oryahovitsa, Bulgaria",10572,0.0,11.0,8.2
2026-02-20 05:00:00,"Bor Gradski park, Serbia",12643,57.0,16.0,0.0
2026-02-20 05:00:00,"Str. P-ţa Independenţei, Brăila, Romania",6841,0.0,19.0,5.5
2026-02-20 05:00:00,"Str. 1 Decembrie 1918, Tecuci, Romania",6857,0.0,13.0,19.1
2026-02-20 05:00:00,"Str. Stefan Cel Mare, Vaslui, Romania",6877,0.0,31.0,13.3
2026-02-20 05:00:00,"Piata Unirii, Timişoara, Romania",7660,0.0,25.0,8.1
2026-02-20 05:00:00,"SNP, Krompachy, Slovakia",3144,91.0,31.0,12.4
2026-02-20 05:00:00,"Roosevelta, Żyrardów, Mazowieckie, Poland",3395,140.0,50.0,0.3
2026-02-20 05:00:00,"Aleea Grădiste, Slatina, Romania",8588,0.0,10.0,7.4
2026-02-20 05:00:00,"Veliki Crljeni, Serbia",14563,25.0,7.0,12.3
2026-02-20 05:00:00,"Str. Cauciucului, Oneşti, Romania",4166,0.0,42.0,30.3
2026-02-20 05:00:00,"Str. Ioan Fluieras, Arad, Romania",4164,0.0,13.0,17.3
2026-02-20 05:00:00,"Nyíregyháza, Nyíregyháza, Hungary",3380,46.0,14.0,3.2
2026-02-20 05:00:00,"Rzeszów-Piłsudskiego-WIOS, Poland",13042,118.0,52.0,31.4
2026-02-20 05:00:00,"Shumen, Bulgaria",10563,0.0,12.0,6.2
2026-02-20 05:00:00,"Str. Soseaua Suruia, Focșani, Romania",4196,0.0,18.0,14.4
2026-02-20 05:00:00,"Str. Uzinei, Râmnicu Vâlcea, Romania",7642,0.0,19.0,17.3
2026-02-20 05:00:00,"Putnok, Putnok, Hungary",3356,0.0,24.0,0.6
2026-02-20 05:00:00,"Str. Tudor Vladimirescu, Calarasi, Romania",6847,0.0,11.0,25.9
2026-02-20 05:00:00,"Pirot, Serbia",14562,26.0,7.0,1.8
2026-02-20 05:00:00,"IZJZ Niš, Niš, Serbia",8577,29.0,10.0,6.5
2026-02-20 05:00:00,"Str. Domnească, Galaţi, Romania",8583,0.0,14.0,33.2
2026-02-20 05:00:00,"Gołuchów, Ujęcie Wody, Poland",14910,0.0,41.0,5.8
2026-02-20 05:00:00,"odesa; Odessa Gonzales, Midland, Texas",196,15.0,0.0,0.0
2026-02-20 05:00:00,"elpueleutodesantamalia; Rio San Pedro, Puerto Real, Spain",8448,21.0,7.0,0.5
2026-02-20 05:00:00,"rhode-saint-genese; Ukkel, Belgium",2992,63.0,20.0,6.4
2026-02-20 05:00:00,"telaviva; Tel Aviv (ישראל, Aviv)",5783,50.0,26.0,4.9
2026-02-20 05:00:00,"telaviva; Komemiyut Train Station - Gush Dan, Israel (ישראל,רכבת קוממיות, גוש דן)",9991,88.0,0.0,21.8
2026-02-20 05:00:00,"telaviva; The Haganah Train - Gush Dan, Israel (ישראל,רכבת ההגנה, גוש דן)",9989,81.0,0.0,25.7
2026-02-20 05:00:00,"telaviva; Yoseftal Train - Gush Dan, Israel (ישראל,רכבת יוספטל, גוש דן)",9990,79.0,0.0,17.1
2026-02-20 05:00:00,"telaviva; The Peace Train - Gush Dan, Israel (ישראל,רכבת השלום, גוש דן)",9992,77.0,0.0,24.3
2026-02-20 05:00:00,"telaviva; Or Yehuda - inner plain, Israel (ישראל,אור יהודה, שפלה פנימית)",9987,63.0,0.0,11.4
2026-02-20 05:00:00,"telaviva; Levinsky, Tel Aviv Metropolitan Area, Israel (ישראל,לוינסקי, גוש דן)",11911,59.0,43.0,17.5
2026-02-20 05:00:00,"telaviva; Hint, Gush Dan, Israel (ישראל,רמז, גוש דן)",2964,54.0,26.0,9.8
2026-02-20 05:00:00,"telaviva; Highway 4, Gush Dan, Israel (ישראל,כביש 4, גוש דן)",2959,51.0,26.0,26.7
2026-02-20 05:00:00,"telaviva; Antokolski Gush Dan, Israel (ישראל,אנטוקולסקי, גוש דן)",2962,50.0,0.0,4.9
2026-02-20 05:00:00,"telaviva; Urban D, Gush Dan, Israel (ישראל,עירוני ד, גוש דן)",2960,50.0,26.0,14.4
2026-02-20 05:00:00,"telaviva; Through the D'', Gush Dan, Israel (ישראל,דרך פ''ת, גוש דן)",2963,47.0,0.0,7.8
2026-02-20 05:00:00,"telaviva; Holon, Gush Dan, Israel (ישראל,חולון, גוש דן)",2958,47.0,26.0,8.9
2026-02-20 05:00:00,"telaviva; Mobile stations 4, Israel (ישראל,ניידת4, תחנות ניידות)",8894,38.0,0.0,11.7
2026-02-20 07:00:00,"T. G. Masaryka, Trebisov, Slovakia",13830,91.0,32.0,3.2
2026-02-20 07:00:00,"Miskolc Lavotta, Miskolc, Hungary",3353,0.0,27.0,0.0
2026-02-20 07:00:00,"Aleea Grădiste, Slatina, Romania",8588,0.0,10.0,10.9
2026-02-20 07:00:00,"Str. Constructorilor, Rovinari, Romania",4176,99.0,39.0,15.8
2026-02-20 07:00:00,"Aleea Castanilor, Copşa Mică, Romania",6871,0.0,38.0,16.3
2026-02-20 07:00:00,"Str. Lalelelor, Alba Iulia, Romania",4162,0.0,33.0,11.1
2026-02-20 07:00:00,"Str. M. Kogălniceanu, Sebeş, Romania",6830,0.0,43.0,15.3
2026-02-20 07:00:00,"Str. Piata Victoriei, Ploieşti, Romania",6868,0.0,27.0,19.7
2026-02-20 07:00:00,"Pirot, Serbia",14562,29.0,10.0,3.5
2026-02-20 07:00:00,"Str. Industriei, Urziceni, Romania",6860,0.0,18.0,11.7
2026-02-20 07:00:00,"Oszlár, Oszlár, Hungary",3355,0.0,24.0,0.0
2026-02-20 07:00:00,"Roosevelta, Żyrardów, Mazowieckie, Poland",3395,152.0,54.0,0.3
2026-02-20 07:00:00,"Dobrich - OU Han Asparuh, Bulgaria",10565,0.0,8.0,0.0
2026-02-20 07:00:00,"Calea Victoriei, Cercul Militar, Romania",7657,0.0,27.0,34.6
2026-02-20 07:00:00,"Comuna Sinandrei, Sinandrei, Romania",4189,0.0,18.0,5.3
2026-02-20 07:00:00,"str. Dorobanti, Nadlac, Romania",6836,0.0,10.0,4.0
2026-02-20 07:00:00,"Varna - SOU Angel Kanchev, Bulgaria",10577,22.0,13.0,6.6
2026-02-20 07:00:00,"Str. Valea Albă, Piatra Neamţ, Romania",4183,141.0,53.0,11.3
2026-02-20 07:00:00,"Borsukowizna-Wiejska, Poland",11817,46.0,11.0,0.2
2026-02-20 07:00:00,"Kielce, ul. Targowa 3, Poland",14911,126.0,59.0,31.1
2026-02-20 07:00:00,"Str. Dunarii, Alexandria, Romania",4160,0.0,12.0,8.3
2026-02-20 07:00:00,"Beograd Borča, Serbia",14781,54.0,14.0,20.7
2026-02-20 07:00:00,"Comuna Ungheni, Ungheni, Romania",8587,0.0,33.0,12.5
2026-02-20 07:00:00,"Str. Rozelor, Oţelu Roşu, Romania",6848,0.0,17.0,5.6
2026-02-20 07:00:00,"Putnok, Putnok, Hungary",3356,0.0,28.0,1.2
2026-02-20 07:00:00,"str. Muncii, Turceni, Romania",7649,0.0,18.0,8.0
2026-02-20 07:00:00,"Str. Stefan Cel Mare, Vaslui, Romania",6877,0.0,30.0,21.6
2026-02-20 07:00:00,"Ursynów, Warszawa, Mazowieckie, Poland",3392,113.0,38.0,30.1
2026-02-20 07:00:00,"Str. Petru Maior, Reşiţa, Romania",4170,0.0,16.0,5.4
2026-02-20 07:00:00,"Nowa Huta, Kraków, Małopolska, Poland",3403,109.0,47.0,14.4
2026-02-20 07:00:00,"Str. Băile Romane, Drobeta Turnu Severin, Romania",6862,0.0,20.0,21.0
2026-02-20 07:00:00,"Str. Soseaua Suruia, Focșani, Romania",4196,0.0,19.0,11.7
2026-02-20 07:00:00,"Str. Ostrovei, Râmnicu Vâlcea, Romania",6876,0.0,23.0,6.1
2026-02-20 07:00:00,"Bdul Bucuresti, Baia Mare, Romania",4181,0.0,8.0,33.9
2026-02-20 07:00:00,"Lublin ul.Obywatelska, Poland",6480,153.0,56.0,20.8
2026-02-20 07:00:00,"Bdul. Dacia, Oradea, Romania",6837,0.0,41.0,4.3
2026-02-20 07:00:00,"Nyíregyháza, Nyíregyháza, Hungary",3380,68.0,22.0,6.5
2026-02-20 07:00:00,"Shumen, Bulgaria",10563,0.0,12.0,6.2
2026-02-20 07:00:00,"G.Oryahovitsa, Bulgaria",10572,0.0,11.0,8.2
2026-02-20 07:00:00,"Str. Carpati, Deva, Romania",7651,0.0,24.0,7.5
2026-02-20 07:00:00,"Str.Alexandru cel Bun, Siret, Romania",6875,0.0,23.0,9.2
2026-02-20 07:00:00,"Szeged 2 Rózsa u., Szeged, Hungary",3337,55.0,10.0,5.2
2026-02-20 07:00:00,"Hernádszurdok, Hernádszurdok, Hungary",3350,85.0,26.0,0.0
2026-02-20 07:00:00,"Gołuchów, Ujęcie Wody, Poland",14910,0.0,41.0,5.8
2026-02-20 07:00:00,"Str. Drumul Taberei, Drumul Taberei, Romania",7656,0.0,26.0,35.4
2026-02-20 07:00:00,"Str. Victoriei, Piteşti, Romania",7644,84.0,28.0,17.8
2026-02-20 07:00:00,"Beograd Surčin, Serbia",14787,34.0,9.0,5.3
2026-02-20 07:00:00,"Str. P-ţa Independenţei, Brăila, Romania",6841,0.0,19.0,8.1
2026-02-20 07:00:00,"Comuna Sânpetru, Sânpetru, Romania",4191,0.0,25.0,8.0
2026-02-20 07:00:00,"Małogoszcz, ul. Słoneczna 18, Poland",14912,119.0,48.0,15.8
2026-02-20 07:00:00,"Str. Mihai Viteazu, Slobozia, Romania",4179,0.0,4.0,21.0
2026-02-20 07:00:00,"Kragujevac, Serbia",14789,30.0,14.0,6.2
2026-02-20 07:00:00,"Beograd Mladenovac, Serbia",14784,38.0,11.0,6.0
2026-02-20 07:00:00,"Beograd Zemun Ugrinovačka, Serbia",14788,51.0,14.0,11.6
2026-02-20 07:00:00,"Str. 1 Decembrie 1918, Tecuci, Romania",6857,0.0,14.0,18.0
2026-02-20 07:00:00,"Str. Rampei, Tarnaveni, Romania",6867,0.0,28.0,6.2
2026-02-20 07:00:00,"Biała Podlaska, Poland",6479,0.0,68.0,25.4
2026-02-20 07:00:00,"Str. Ioan Fluieras, Arad, Romania",4164,0.0,12.0,14.5
2026-02-20 07:00:00,"Nam. slobody, Humenne, Slovakia",3126,89.0,29.0,5.1
2026-02-20 07:00:00,"Comuna Valiug, Semenic, Romania",6855,0.0,13.0,3.1
2026-02-20 07:00:00,"Eger 2 Malomárok u., Eger, Hungary",3349,0.0,13.0,12.7
2026-02-20 07:00:00,"SNP, Krompachy, Slovakia",3144,95.0,31.0,13.3
2026-02-20 07:00:00,"Starachowice, ul. Złota, Poland",14913,156.0,80.0,0.0
2026-02-20 07:00:00,"Str. Aurel Vlaicu, Cluj-Napoca, Romania",8591,0.0,24.0,28.0
2026-02-20 07:00:00,"Kazincbarcika, Kazincbarcika, Hungary",3351,61.0,17.0,5.6
2026-02-20 07:00:00,"Tarnów-ul. Ks. Romana Sitko, Małopolska, Poland",8690,112.0,48.0,24.5
2026-02-20 07:00:00,"Sos. Sloboziei, Giurgiu, Romania",8585,0.0,19.0,20.3
2026-02-20 07:00:00,"Calea Bucuresti, Craiova, Romania",8580,0.0,21.0,16.0
2026-02-20 07:00:00,"Smederevo Centar, Serbia",9259,58.0,18.0,18.3
2026-02-20 07:00:00,"Beograd Lazarevac, Serbia",14560,61.0,21.0,3.4
2026-02-20 07:00:00,"Nowiny ul. Parkowa, Poland",6550,0.0,62.0,19.1
2026-02-20 07:00:00,"Brzozowa, Otwock, Mazowieckie, Poland",9037,235.0,116.0,22.7
2026-02-20 07:00:00,"Smederevo Radinac, Serbia",14566,42.0,11.0,2.1
2026-02-20 07:00:00,"Obrenovac Centar, Serbia",9254,28.0,8.0,5.3
2026-02-20 07:00:00,"Str. Libertăţii, Târgu Mureş, Romania",6865,0.0,30.0,26.0
2026-02-20 07:00:00,"Jarosław-PWSTE-WIOS, Poland",13040,139.0,53.0,0.0
2026-02-20 07:00:00,"Nowy Sącz, Małopolska, Poland",3404,63.0,24.0,8.9
2026-02-20 07:00:00,"Vratsa - ZHP Gara, Bulgaria",10561,0.0,8.0,2.9
